model_comparison.csv

Model,Accuracy,AUC,Precision,Recall,F1,MCC
Logistic Regression,0.9206757253029747,0.9933984516940367,0.9215328435004574,0.9206757253029747,0.9208728071055451,0.9041666634728006
Decision Tree,0.8916636063165626,0.9329623772083053,0.8912470304116911,0.8916636063165626,0.8913219229524194,0.869058835971552
KNN,0.9166360631656262,0.9812466098253438,0.9174092603022151,0.9166360631656262,0.9168048079580466,0.8992035213926259
Naive Bayes,0.7638633859713552,0.9644421096213359,0.7653708847319572,0.7638633859713552,0.7614742997970327,0.7154063217966201
Support Vector Machine,0.9221446933529196,0.9936803481114389,0.9224256521079515,0.9221446933529196,0.9221767190269773,0.9058700549308653

README.md

## 6. Observations

Support Vector Machine (SVM): Achieved the highest overall performance with 92.21% accuracy and an AUC of 99.37%. It also recorded the highest Precision (92.24%), Recall (92.21%), F1 Score (92.22%) and MCC (0.9059).
Logistic Regression: Demonstrated performance comparable to SVM, achieving 92.07% accuracy and 99.34% AUC. This indicates that Logistic Regression is also highly effective for classifying dry bean varieties.
K-Nearest Neighbours (KNN): Achieved 91.66% accuracy and 98.12% AUC, demonstrating strong classification capabilities based on the similarity between observations.
Decision Tree: Recorded 89.17% accuracy and 93.30% AUC. Although its performance was lower than the first three algorithms, it provided reasonably good classification results.
Gaussian Naive Bayes: Achieved 76.39% accuracy and 96.44% AUC. It recorded the lowest accuracy among the five algorithms, indicating comparatively weaker classification performance.